{
  "$schema":"https://json-schema.org/draft/2020-12/schema", "type":"object", "additionalProperties":false,
  "required":["schemaVersion","cpython","uv","winsw","pythonBuildStandaloneLicenses"],
  "$defs":{"sha256":{"type":"string","pattern":"^[a-f0-9]{64}$"},"artifact":{"type":"object","additionalProperties":false,"required":["version","fileName","url","architecture","size","sha256","licenses"],"properties":{"version":{"type":"string","minLength":1},"fileName":{"type":"string","pattern":"^[A-Za-z0-9._+%-]+$"},"url":{"type":"string","pattern":"^https://github\\.com/"},"architecture":{"type":"string","minLength":1},"size":{"type":"integer","minimum":1},"sha256":{"$ref":"#/$defs/sha256"},"licenses":{"type":"array","minItems":1,"items":{"type":"string","minLength":1}}}}},
  "properties":{"schemaVersion":{"const":"1"},"cpython":{"$ref":"#/$defs/artifact"},"uv":{"$ref":"#/$defs/artifact"},"winsw":{"$ref":"#/$defs/artifact"},"pythonBuildStandaloneLicenses":{"type":"object","additionalProperties":false,"required":["url","size","sha256"],"properties":{"url":{"type":"string","pattern":"^https://raw\\.githubusercontent\\.com/"},"size":{"type":"integer","minimum":1},"sha256":{"$ref":"#/$defs/sha256"}}}}
}
