{
  "schemaVersion": "1",
  "cpython": {
    "version": "3.11.16+20260825",
    "fileName": "cpython-3.11.16+20260825-x86_64-pc-windows-msvc-install_only_stripped.tar.gz",
    "url": "https://github.com/astral-sh/python-build-standalone/releases/download/20260825/cpython-3.11.16%2B20260825-x86_64-pc-windows-msvc-install_only_stripped.tar.gz",
    "architecture": "x86_64-pc-windows-msvc",
    "size": 25723669,
    "sha256": "f91242b07e318d2540f9da71162b92d494c39745abde9b994d7d906756453fc9",
    "licenses": ["Python-2.0", "CNRI-Python", "bundled-component-licenses"]
  },
  "uv": {
    "version": "0.12.7",
    "fileName": "uv-x86_64-pc-windows-msvc.zip",
    "url": "https://github.com/astral-sh/uv/releases/download/0.12.7/uv-x86_64-pc-windows-msvc.zip",
    "architecture": "x86_64-pc-windows-msvc",
    "size": 16979508,
    "sha256": "bf1518af459a3915511a11fdc6e2f43ef9a2afa138b9d498eeb9642fe9d85218",
    "licenses": ["MIT", "Apache-2.0"]
  },
  "winsw": {
    "version": "2.12.0",
    "fileName": "WinSW-x64.exe",
    "url": "https://github.com/winsw/winsw/releases/download/v2.12.0/WinSW-x64.exe",
    "architecture": "amd64-pe",
    "size": 18243033,
    "sha256": "05b82d46ad331cc16bdc00de5c6332c1ef818df8ceefcd49c726553209b3a0da",
    "licenses": ["MIT"]
  },
  "pythonBuildStandaloneLicenses": {
    "url": "https://raw.githubusercontent.com/astral-sh/python-build-standalone/20260825/python-licenses.rst",
    "size": 105875,
    "sha256": "e43fb936c6655d7996dba480d7ebdea492d6040ec388eb8ed9d1000f72de8cab"
  }
}
